Tweet_Tidspunkt,Text,Rank
2019-09-17 12:25:00,elonaccessories teslaownerssv flcnhvy teslarati actually model 3 would beat the taycan on nã¼rburgring over multiple laps as it has more range,0
2019-09-17 12:26:00,dmcryan justpaulinelol teslarati exactly,0
2019-09-17 12:28:00,flcnhvy elonaccessories teslaownerssv teslarati you never know â¦,0
2019-09-17 12:38:00,tfm312 tesla glad youâre ok,0
2019-09-17 15:38:00,28delayslater tesla haha,0
2019-09-17 15:40:00,harrystoltz1 28delayslater tesla a little but this is mostly a design update for those interested,0
2019-09-18 11:26:00,jasonwhansen tesla yes,0
2019-09-23 13:41:00,teslamiles 28delayslater karpathy tesla og roadster is def helping us out here with 826m miles by itself ,0
2019-09-23 13:44:00,mich41v4294 flcnhvy 28delayslater karpathy hoping to open in slovakia croatia serbia amp most of eastern europe early next year finally we will do nikola tesla proud by having his cars in his countries of origin,0
2019-09-24 15:53:00,teslarati tesla is building a major engineering team in china incl heavy focus on softwarefirmware for factory amp car,0
2019-09-24 15:55:00,teslarati this includes original engineering of new factory processes amp cars great engineers will only join if original engineering is supported not just localization,0
2019-09-24 15:58:00,flcnhvy erdayastronaut tesla it would be pretty embarrassing to use a nontesla battery,0
2019-09-26 10:57:00,tesla v100 just started rolling out to all us tesla owners with fsd option amp âadvanced downloadâ selected in vehicle software settings,0
2019-10-01 13:02:00,rationaletienne laurenrow5 evafoxu kristennetten stevehamel16 theelonmasked memesofmars michellbasler mayemusk kimbal agreed amp such a heartwarming photo â¥ï¸,0
2019-10-09 13:41:00,tesla software v100 comes with karaoke ð¤,0
2019-10-09 13:50:00,teslatruth no change,0
2019-10-09 13:51:00,annerajb teslatruth yes,0
2019-10-09 13:54:00,kristennetten annerajb teslatruth ðð ð§ ð³,0
2019-10-09 14:52:00,teslarati weâre changing powerwall storm watch to disaster watch covers more bases,0
2019-10-10 12:08:00,gfilche tesla fundamental metric of good of tesla is how many years sooner it brings the advent of a sustainable energy future,0
2019-10-14 12:03:00,yogisc1127 tesla deep rainâ¢ï¸ neural net coming soon weâre not trademarking any other autopilot neural nets just this one because rain is deep,0
2019-10-14 12:09:00,annerajb yogisc1127 tesla it is actually called deep rain as sort of a joke at tesla takes a surprising amount of deep learning to know when amp how fast to move the wipers,0
2019-10-14 12:18:00,teslatruth annerajb yogisc1127 tesla true,0
2019-10-14 12:29:00,teslaaddicted will start rendering traffic cones in the display soon,0
2019-10-14 12:30:00,stevemartineau6 annerajb yogisc1127 tesla yes,0
2019-10-14 12:30:00,annerajb teslaaddicted software,0
2019-10-16 15:29:00,tesla wins best headlights award ð¥ ,0
2019-10-21 15:50:00,order tesla solar  powerwall battery for 247 clean power amp no blackouts ,0
2019-10-23 12:01:00,teslatino please lmk about your experience and what can be improved,0
2019-10-23 12:02:00,teslatino internal camera isnât used yet meant for robotaxi but thatâs a good idea,0
2019-10-25 15:27:00,teslany spacex gwynne rocks starlink will probably be a little bumpy at first but then improve rapidly,0
2019-10-25 15:34:00,maybe call tesla solar roof tiles product solarglass like dragonglass but solar,0
2019-10-28 11:49:00,tesla solar plus powerwall battery backup for 247 clean energy amp no blackouts at ,0
2019-10-28 11:59:00,teslaownerssv will do what we can for anyplace affected by natural disasters,0
2019-10-28 12:11:00,flcnhvy teslaownerssv iâd recommend regular solar panels for flat roofs,0
2019-10-28 14:09:00,if youâre directly affected by wildfire power outages tesla is reducing solarpowerwall prices by 1000 as of today,0
2019-10-28 14:46:00,unfortunately itâs hard to google tesla solar links due to tons of ads amp seo go to  to add solar to an existing roof amp  for a new roof with integrated solar,0
2019-10-31 12:26:00,teslarati drag race times analysis is correct also thereâs a software upgrade for model s coming out that increases peak power by 50hp so model s should beat porsche taycan turbo s by a wider margin in 0 to 60 amp 14 mile races,0
2019-10-31 12:29:00,stephenpallotta teslarati sorry drag times is correct top gear is wrong,0
2019-11-01 10:32:00,teslarati putting model s in range mode is the opposite of launch mode as it minimizes performance in favor of range show should be called âlow gearâ,0
2019-11-05 14:07:00,teslarati connected autonomous cars require great software advanced factories also require great software the car industry is not very good at software,0
2019-11-06 10:40:00,teslarati this is based on an incorrect electrek article the air force asked me to speak at a startup conference called âpitch dayâ amp i happened to mention cybertruck they donât buy apcs itâs the air force,0
2019-11-06 11:08:00,justpaulinelol teslarati naturally,0
2019-11-06 11:09:00,fredericlambert teslarati the audience of entrepreneurs should try it not the af,0
2019-11-06 11:10:00,ryanth3nerd teslarati yes,0
2019-11-06 11:10:00,uhaveanygrapes teslarati looking into it,0
2019-11-06 11:15:00,cybertruck unveil on nov 21 in la near spacex rocket factory,0
2019-11-18 13:48:00,teslarati even toyota who made the prius that is sad,0
2019-11-18 13:54:00,teslaownerssv teslarati not sure maybe write or message carmakers who oppose the environmental initiative,0
2019-11-20 14:31:00,teslatested so many reporters gave chanos airtime when he called tesla a worthless fraud now that he has been proven wrong silence â¦,0
2019-11-22 09:37:00,moesargi tesla 2 person electric atv will come at first as an option for cybertruck,0
2019-11-22 10:13:00,mithunoorath tesla yes,0
2019-11-25 15:58:00,halo pewdiepie cybertruck is inspired by games like halo warthog irl,0
2019-11-27 10:57:00,renatakonkoly tesla teslarati insideevs ð¤£ð¤£,0
2019-11-27 11:05:00,thewalkingdead tesla the finest in apocalypse protection technology flamethrower optional,0
2019-12-24 13:09:00,erdayastronaut tesla yes,0
2019-12-26 13:03:00,teslaownersofma tesla disneyplus bensullins coming soon,0
2019-12-26 13:16:00,teslaownerssv teslaunplugged teslaownersofma tesla disneyplus bensullins no,0
2019-12-26 13:35:00,teslaownerssv teslaunplugged teslaownersofma tesla disneyplus bensullins car should autonavigate to destinations based on your calendar if nothing in calendar should do work in morning amp home in evening future versions will guess based on prior patterns if preference enabled,0
2019-12-26 13:39:00,"teslaownerssv teslaunplugged teslaownersofma tesla disneyplus bensullins merry christmas ððð
hope youâre enjoying latest software update",0
2019-12-26 13:40:00,teslatino teslaownerssv teslaunplugged teslaownersofma tesla disneyplus bensullins if you enter a longer distance than range system should autonav to optimal superchargers along the way is it not doing this correctly,0
2019-12-26 13:45:00,just swipe down on tesla nav button for car to automatically navigate to home work or destination in calendar,0
2019-12-26 15:15:00,flcnhvy sofiaan erdayastronaut the overarching goal of tesla engineering is maximize area under user happiness curve,0
2020-01-08 12:05:00,"â¥ï¸â¥ï¸ tesla china team â¥ï¸â¥ï¸
     such amazing progress",0
2020-01-15 12:09:00,nntaleb just saw this today tesla refunds in general should be easy to get electronically amp certainly through customer service will he addressed,0
2020-01-16 15:12:00,teslarati sorry migh have brought the site down,0
2020-01-21 11:24:00,flcnhvy thirdrowtesla gfilche sofiaan kristennetten vincent13031925 great talking with thirdrowtesla,0
2020-01-21 11:29:00,picklepunchd flcnhvy thirdrowtesla gfilche sofiaan kristennetten vincent13031925 walk this way ,0
2020-01-21 12:07:00,vmone1 exhaustedpengu1 rationaletienne would like to take a moment to thank michael amp zeâev for helping tesla it was very hard work amp both couldâve just rested on their laurels much appreciated ð»,0
2020-01-24 13:00:00,erdayastronaut trevormahlmann tesla v3 supercharger deployment will accelerate considerably this year,0
2020-01-29 14:08:00,a friend just sent me this excerpt from a tesla blog i wrote 14 years ago ,0
2020-02-10 12:25:00,please let us know what improvements we can make to any aspect of tesla solarglass roof critical feedback is much appreciated,0
2020-02-10 12:26:00,gdphotographr sounds like we should open a tesla center there,0
2020-02-10 12:41:00,should preface this saying that feedback from early tesla solar roof owners has been v positive itâs stunning vs a regular roof in person imo photos donât do it justice,0
2020-02-10 12:49:00,tesla april company talk will be from our giga new york factory where we make solarglass amp several other products will also offer customer amp media tours,0
2020-02-14 14:08:00,teslaownerssv tesla will take action,0
2020-02-21 14:48:00,teslarati active ride height amp active damping are gamechanging for a truck or any car with a high maxmin weight ratio,0
2020-02-21 15:54:00,teslarati btw in some prior tweets iâd said production cybertruck would be 80â wide vs 84â body width at unveil this is slightly too small will be closer to 82â but come standard with upper laser blade lights,0
2020-02-26 11:52:00,janeidyeve jakethehuman28 teslatruth twitter posting spacex videos is definitely not copyright infringement,0
2020-02-26 12:20:00,erdayastronaut janeidyeve jakethehuman28 teslatruth twitter sure,1
2020-03-04 13:18:00,sofiaan tesla true oddly those who complained didnât actually order fsd perhaps they werenât aware that the computer is upgraded for free if the fsd option is ordered even after delivery,0
2020-03-04 13:20:00,erdayastronaut sofiaan tesla cool weâre tracking to release more fsd features later this month,0
2020-03-04 13:23:00,justpaulinelol erdayastronaut sofiaan tesla weâre making progress improved rules are going through the eu standards committees hopefully better in a few months,0
2020-03-11 11:29:00,samtalkstesla janeidyeve mars is god of war amp memes are a form of war â¦ and fun too neither will be destroyed ceres moons of jupiter amp saturn prob come next,0
2020-03-11 11:37:00,teslatino tesla checking,0
2020-03-24 14:09:00,flcnhvy thirdrowtesla this is messed up mikebloomberg,0
2020-03-24 14:14:00,steezyysosa teslatino flcnhvy thirdrowtesla mikebloomberg twitter have let twitter know,0
2020-03-24 14:22:00,samtalkstesla mikebloomberg true mikebloomberg this is  accurate you believe in journalistic integrity but if something isnât done this will continue,1
2020-03-25 14:28:00,flcnhvy tesla making good progress we will do whatever is needed to help in these difficult times,0
2020-03-25 14:31:00,ppathole flcnhvy tesla yes is there more should be a lot of data by now,0
2020-03-25 15:17:00,ppathole flcnhvy tesla c19 testing in the us over the past week has grown much faster than c19 positive cases i think we may have passed the inflection point for us cases excluding ny already,0
2020-03-25 15:41:00,enscand ppathole flcnhvy tesla something weird happened at cdc yesterday they changed the graph to include âestimated illness onset dateâ this is a significantly less rigorous standard ,0
2020-03-25 15:46:00,flcnhvy tesla giga new york will reopen for ventilator production as soon as humanly possible we will do anything in our power to help the citizens of new york,0
2020-03-27 11:13:00,nycmayor youâre most welcome credit to the tesla team will do our best to help in any way,0
2020-03-27 11:27:00,nycmayor biggest value tesla is providing is precise delivery of ventilators exactly to the icu where amp when theyâre needed there are many ventilators in warehouses but stuck in logisticsroutingpaperwork issues,0
2020-03-30 14:22:00,teslaownerssv seeing friends,0
2020-03-31 11:11:00,teslarati bocachicagal the legs extend amp telescope out so are longer than they seem but not as long as they will be for sn4,0
2020-03-31 11:27:00,we have extra fdaapproved ventilators will ship to hospitals worldwide within tesla delivery regions device amp shipping cost are free only requirement is that the vents are needed immediately for patients not stored in a warehouse please me or tesla know,0
2020-03-31 15:07:00,nychealthsystem tesla happy we could be helpful more available if needed,0
2020-04-02 15:50:00,28delayslater thirdrowtesla exactly moreover all hospitals were given exact specifications of resmed amp philips ventilators before delivery amp all confirmed they would be critical,1
2020-04-02 15:51:00,28delayslater thirdrowtesla invasive ventilators are for worst case patients survival rate at that point is low as gov cuomo has pointed out nonetheless we start delivery of intratracheal medtronic units in nyc tonight,0
2020-04-09 11:39:00,mountsinainyc tesla youâre welcome,0
2020-04-13 14:05:00,thirdrowtesla this will happen,0
2020-04-16 13:54:00,partial list of hospitals to which tesla sent ventilators ,0
2020-04-17 14:48:00,covellomassimo tesla will do,0
2020-04-22 10:50:00,animevirus flcnhvy thirdrowtesla mfrunker if this launch succeeds we will have put up 422 satellites â¦,0
2020-04-22 11:42:00,owensparks flcnhvy animevirus thirdrowtesla mfrunker yes,0
2020-04-22 11:45:00,erdayastronaut flcnhvy animevirus thirdrowtesla mfrunker solar panel angle during orbit raise  park weâre fixing it now,0
2020-04-22 11:49:00,teslatino flcnhvy animevirus thirdrowtesla mfrunker spacex itâs made of a special dark foam thatâs extremely radio transparent so as not to affect the phased array antennas looks a lot like a car sun visor,0
2020-04-23 13:20:00,teslaownerssv togregto side camera view looks a little weird as meant for selfdriving but will review with team image will need a little postprocessing,0
2020-04-23 13:22:00,jgrano305 teslaownerssv togregto will talk with team we have a lot on our plate,0
2020-04-23 13:57:00,ajtourville psidart togregto maybe cybertruck will have it â¦,0
2020-05-01 11:11:00,tesla stock price is too high imo,-1
2020-05-06 12:19:00,inspacexitrust spacestation tesla spacex commercialcrew that was the whole company back then grew organically from a simple mariachi party in el segundo,0
2020-05-07 15:23:00,erdayastronaut elonharith flcnhvy nasaspaceflight sls makes me feel sad,0
2020-05-11 13:01:00,thirdrowtesla yes this is insane,0
2020-05-11 13:07:00,thirdrowtesla lorenasgonzalez interesting,0
2020-05-11 13:32:00,hidalgocounty judgecortez govabbott tesla johnjwitt note is much appreciated,0
2020-05-12 14:08:00,thirdrowtesla itâs not often that the governor of california amp the president agree,0
2020-05-13 14:00:00,rosileseddie thirdrowtesla acsosheriffs gavinnewsom the custom styling some of the team is doing over their masks is really cool,-1
2020-05-14 15:06:00,tesla supercharger usage by region ,0
2020-05-26 14:40:00,samtalkstesla rationaletienne thirdrowtesla wholemarslog 28delayslater vincent13031925 teslaownerssv haha true,0
2020-05-29 14:29:00,cleantechnica worth noting that as of jan 1 tesla buyers no longer received any federal tax credit model 3 led despite this disadvantage,0
2020-06-08 12:27:00,emmerichvideo tesla good point,0
2020-06-08 13:46:00,ppathole tesla autopilot prime directive is donât crash what seems fast to humans is slow to a computer 360 degree low light vision amp sonar plus forward radar enable to be superhuman upcoming software upgrades will increasingly show the potential,0
2020-06-10 10:00:00,"gerberkawasaki tesla formerly mainstream media has systemic negative amp political bias about almost everything reading major newspapers makes you feel sad amp angry thatâs why theyâre being crushed by joerogan likesretweets of old media are extremely low ironic article
",0
2020-06-10 10:02:00,icannotenough gerberkawasaki tesla joerogan yes,0
2020-06-10 10:03:00,flcnhvy gerberkawasaki tesla joerogan good point,-1
2020-06-10 10:05:00,flcnhvy gerberkawasaki tesla joerogan maybe i should retweet the top four or five point what caught your eye the most,0
2020-06-10 10:06:00,jgrano305 icannotenough gerberkawasaki tesla joerogan we shall see â¦,0
2020-06-10 14:07:00,posting tesla impact report this time with summary points amp charts in my reply tweets ,0
2020-06-10 14:22:00,moreover energy produced by tesla solar deployments far exceeds energy used in our factories ,0
2020-06-10 14:26:00,tesla batteries are lasting much longer than 200k miles  320k km ,0
2020-06-10 15:06:00,tesla factory workplace safety is 5 better than industry average for manufacturers amp improving fast ,0
2020-06-16 12:45:00,teslarati fairing reuse is looking good,0
2020-06-18 15:39:00,teslarati tesla has an option to purchase this land but has not exercised it,0
2020-06-19 12:40:00,katriniadivina teslaphx tesla opening in about two weeks,0
2020-06-19 13:03:00,evafoxu tesla moving fast,0
2020-06-19 13:06:00,juneteenth is henceforth considered a us holiday at tesla amp spacex,0
2020-06-25 14:23:00,bluebnd tomabbotdavies1 tesla thirdrowtesla teslaownerssv teslapodcast teslaownersww teslaownersuk model3owners looks pretty cool,0
2020-06-26 13:21:00,vincent13031925 teslaroadtrip glad you like it,0
2020-06-26 15:06:00,teslarati giga berlin is gonna rock,0
2020-06-26 15:12:00,flcnhvy teslarati absolutely,0
2020-07-01 15:30:00,"tesla impact report repost we do everything humanly possible to source materials amp produce sustainable energy cars batteries amp solar ethically suggestions for improvement are always appreciated

",0
2020-07-02 12:25:00,truthtesla bipulh lithium is common hard part is turning lithium salt or clay into extremely pure lioh,0
2020-07-02 13:08:00,eugenelee3 teslarati i tried to warn them â¦ ð¢,0
2020-07-02 14:40:00,tesla will make fabulous short shorts in radiant red satin with gold trim,0
2020-07-02 14:57:00,sec three letter acronym middle word is elonâs,0
2020-07-02 15:25:00,samtalkstesla not bad,0
2020-07-10 12:47:00,evafoxu tesla berlin model y is the one to watch that is a revolution in automotive body engineering finally,0
2020-07-10 12:48:00,scr00chy evafoxu tesla ð,0
2020-07-10 12:49:00,techgnostik evafoxu tesla ok,0
2020-07-10 12:50:00,bluebnd evafoxu tesla even more,0
2020-07-10 12:53:00,mjkapkan evafoxu tesla probably a good one to design amp engineer in germany,0
2020-07-10 13:02:00,teslaparatodos evafoxu tesla ð,0
2020-07-10 13:52:00,flcnhvy ppathole ihearttesla absolutely,0
2020-07-10 14:00:00,thatt3slaguy flcnhvy ppathole ihearttesla earning power post augmentation would easily pay for itself if thatâs even necessary this is the best thing i can think of to ensure that collective human will decides the future,0
2020-07-10 14:46:00,rationaletienne flcnhvy ppathole ihearttesla death is the loss of information,0
2020-07-14 14:41:00,efficiencylast jaminwestby teslaownerssv jgrano305 teslaratiteam teslarati should do this automatically,0
2020-07-14 14:42:00,engineersfeed playable on any tesla,0
2020-07-14 14:45:00,teslaownerssv engineersfeed the strength amp perseverance of the people of tesla despite facing extreme difficulties,0
2020-07-14 14:48:00,wholemarsblog tesla autopilot was literally named after the term used in aviation also what about autobahn,-1
2020-07-14 14:53:00,teslaaircraft flcnhvy tesla exactly,0
2020-07-21 12:31:00,teslarati bocachicagal weâre rapidly changing alloy constituents amp forming methods so traditional names like 304l will become more of an approximation,0
2020-07-21 12:33:00,glenn22x teslarati bocachicagal yes,0
2020-07-21 12:49:00,ppathole teslarati bocachicagal will attempt to fly later this week,0
2020-07-21 13:09:00,samtalkstesla sometimes thatâs how i feel too,-1
2020-07-24 10:12:00,realdonaldtrump tesla thank you on behalf of the tesla team we look forward to building giga texas,-1
2020-07-24 10:39:00,"tesla solar panels are 149watt 
",0
2020-07-27 15:17:00,teslarati sounds great,0
2020-08-07 13:48:00,teslarati ,0
2020-08-07 13:52:00,timothybuffett teslarati apart from failing to quarantine elderlyatrisk people early a mistake they recognize they were right,0
2020-08-07 14:03:00,renatakonkoly timothybuffett teslarati janeidyeve ok,0
2020-08-11 14:36:00,teslarati a little toastier each flight,0
2020-08-12 10:28:00,teslarati no surprise,0
2020-08-14 14:51:00,teslarati tesla team is working hard on increasing powerwall production,0
2020-08-14 14:59:00,viktaur27 teslarati the rate of improvement from original gpt to gpt3 is impressive if this rate of improvement continues gpt5 or 6 could be indistinguishable from the smartest humans just my opinion not an endorsement i left openai 2 to 3 years ago am a neutral outsider at this point,0
2020-08-19 15:33:00,teslatested thatâs an error in canada the lease payment is specifically lower than loan financing as tesla expects to repossess the car this is essentially a bet on residual value if you believe residual value will rise buy on loan if you think it will drop then lease,0
2020-08-19 15:37:00,everydayelon ajtourville commaai tesmaniancom yes,0
2020-08-20 15:11:00,more fun games coming soon to ur tesla,0
2020-08-26 13:02:00,erdayastronaut tesla no weâre focused on developing new products amp scaling production,0
2020-09-09 13:15:00,rbreich all tesla workers also get stock so their compensation increased proportionately you are a modern day moron,0
2020-10-01 15:01:00,model3owners futurejurvetson cfsenergy cupplasma mit thatâs very hard to do have you tried pushing on the charge port door to open itâs designed to support a manual press to open as well as automatic,0
2020-10-01 15:23:00,thatt3slaguy model3owners futurejurvetson cfsenergy cupplasma mit yes coming soon,0
2020-10-01 15:24:00,somiteslagirl model3owners futurejurvetson cfsenergy cupplasma mit the new heat pump in model y is what really makes the difference in cold weather,0
2020-10-02 13:42:00,sofiaan tesla haha,0
2020-10-02 14:10:00,mike94160775 tesla electrekco teslarati glad youâre ok,0
2020-10-06 12:11:00,dirtytesla spacex it will soon,0
2020-10-07 09:50:00,samtalkstesla spacex much sooner,0
2020-10-07 11:30:00,raytech247 wholemarsblog the model 3 production ramp was sheer agony for two years but that was do or die for tesla no us car company has reached high volume production with sustained free cash flow in 100 years hundreds of car startups all died or were absorbed for peanuts by big three,0
2020-10-07 11:31:00,raytech247 wholemarsblog even gm amp chrysler went bankrupt in 2009 ford and tesla are the only us car companies that have avoided bankruptcy,0
2020-10-07 11:52:00,teslaownerssv raytech247 wholemarsblog yes the gigafactory is the hardest amp most critical product,0
2020-10-07 12:02:00,flcnhvy teslaownerssv raytech247 wholemarsblog that would be like licensing battlestar galactica actually building continuously evolving gargantuan factories is the hard part lots of people who worked at tesla gigafactories now work at competitors but none of those companies have made one,0
2020-10-07 12:10:00,tesladri chananbos raytech247 wholemarsblog the crash absorption rails can be cut off amp replaced with a bolted part for collision repair,0
2020-10-08 14:03:00,tashaark waymo is impressive but a highly specialized solution the tesla approach is a general solution the latest build is capable of zero intervention drives will release limited beta in a few weeks,0
2020-10-14 13:43:00,teslarati making progress,0
2020-10-14 14:08:00,gem8mingen tesla congratulations,0
2020-10-14 15:01:00,"the gauntlet has been thrown down 

the prophecy will be fulfilled 

model s price changes to 69420 tonight",0
2020-10-14 15:03:00,teslaownerssv starting production on 7 seater next month initial deliveries early december,0
2020-10-29 14:41:00,teslarati truth is stranger than fiction,0
2020-11-02 15:24:00,ennnafnlaus flcnhvy didnât realize that was possible no problem if thereâs a way get current design cybertruck approved in europe,0
2020-11-03 09:53:00,vincent13031925 jonerlichman i put in my last money even though i thought we would still fail but it was either that or certain death for tesla extremely difficult to raise money for an electric car startup considered super quirky back then while stalwarts like gm amp chrysler were going bankrupt,-1
2020-11-03 09:59:00,zainraz4 vincent13031925 jonerlichman closest we got was about a month the model 3 ramp was extreme stress amp pain for a long time â from mid 2017 to mid 2019 production amp logistics hell,1
2020-11-09 10:39:00,teslaownerssv tesla thanks to a lot of great autopilotai hardware amp software engineers at tesla,0
2020-11-10 11:12:00,teslany tesla happy to see this ,0
2020-11-13 12:04:00,johnbeans dirtytesla interesting,0
2020-11-16 14:07:00,samtalkstesla iâm ok thanks for asking no symptoms for past few days apart from fatigue unless something changes would have to say that it simply felt like a mild cold,0
2020-11-16 14:46:00,whatsupfranks michaelminalab curevac moderna amp a few others tesla makes the machine curevac uses to go from known gene sequence to trillions of lipidcoated mrna strands,0
2020-11-17 10:57:00,greenisclutch johnnacrider1 timmerenginerd jack theyâre on their way hopefully more teslaquila next month,0
2020-11-18 11:45:00,teslaownerssv astrojordy flcnhvy no just a mild cold same with my bro def had cov2 though pclt20 means viral load of gt10 million per ml,0
2020-11-18 12:31:00,garyblack00 the only publicly traded stock i own is tesla,0
