Tweet_Tidspunkt,Text,Rank
2018-06-08 13:24:00,dmcryan talked with tesla team looks like we can do the aluminum model 3 pedal covers slightly different from s turning on production for model 3 performance version,0
2018-06-08 13:29:00,teslaology dmcryan tesla weâre building out tesla body repair in all major metro areas to ensure super fast amp excellent outcome,0
2018-06-12 14:02:00,difficult but necessary tesla reorg underway my email to the company has already leaked to media here it is unfiltered ,0
2018-06-13 14:38:00,korihale tesla culturebanx forbes we use less than 3 cobalt in our batteries amp will use none in next gen,0
2018-06-15 12:37:00,fredericlambert already sold gt100m tsla for charity will do about that every few years major disbursements in about 20 years when tesla is steady state,0
2018-06-20 13:12:00,cfarivar there is more but the actions of a few bad apples will not stop tesla from reaching its goals with 40000 people the worst 1 in 1000 will have issues thatâs still 40 people,0
2018-06-22 14:11:00,model3owners was thinking of offering an extended tesla factory tour option where you could help build part of a car amp understand how they come together i know it would have been super fun for me when i was a kid or now,0
2018-06-22 14:13:00,fredericlambert model3owners that would be tricky to sequence but maybe,0
2018-06-26 13:21:00,justwidle2 tesla then you will really hate that tesla scored 100100 four years in a row on lgbtq equality ,0
2018-06-26 13:44:00,justwidle2 tesla donât buy our car if thatâs a problem people should be free to live their lives where their heart takes them â¤ï¸ð§¡ððððð¤ðð,0
2018-06-26 13:57:00,ev20018 justwidle2 tesla âvirtue signalingâ is super annoying amp there are lots of phoneys who are actually huge jerks but jump on every social cause du jour but iâm really proud of the fact that  of changes tesla had to make to achieve 100100 before even knowing about the lgbtq index was zero,0
2018-06-26 14:08:00,what would you love to see in a tesla pickup truck i have a few things in mind but what do you think are small but important nuances amp what would be seriously next level,0
2018-06-26 14:30:00,the tesla truck will have dual motor allwheel drive w crazy torque amp a suspension that dynamically adjusts for load those will be standard,0
2018-07-05 13:26:00,stetopinini spadival lopezlinette indeed very simple question to be specific lopezlinette did you compensate or promise to compensate martin tripp for inside information about tesla did he under that inducement provide you with exaggerated negative info which you printed but turned out to be untrue,0
2018-07-05 14:02:00,teslabull what a coincidence â¦,-1
2018-07-05 14:13:00,scottwww stetopinini spadival lopezlinette lopezlinette you stated publicly that you âsee eye to eyeâ with chanos the most prominent shortseller of tesla have you ever provided him with material nonpublic information about tesla,0
2018-07-05 14:42:00,vincent13031925 teslabull scottwww stetopinini spadival lopezlinette so lopezlinette publicly stated she stans for chanos teslaâs most prominent shortseller in her words he is âone of the greatestâ her articles print chanosâs view verbatim this is not journalism,0
2018-07-05 15:22:00,tombrechet vassilyk flatjannrickles vincent13031925 teslabull scottwww stetopinini spadival lopezlinette tesla sounds fishy how did that go down,0
2018-07-10 13:24:00,dmcryan should be very soon weâve already made around 100 model 3 performance cars for test drives in stores,0
2018-07-11 10:33:00,annerajb definitely canât wait to try that been a little distracted past few months on mostly tesla matters but back at it soon,0
2018-07-23 14:24:00,willfealey tesla teslaownersuk wow thatâs really awesome thank you â¥ï¸teslaownersuk,0
2018-07-27 14:38:00,philhellmuth tesla thanks phil,0
2018-07-31 14:36:00,andredalmeida yeah model 3 is designed to fit 6â4â  adults comfortably in both front amp rear seats at same time,0
2018-07-31 14:39:00,ilehonardo canât wait to bring tesla to brazil one of my favorite countries,0
2018-08-01 14:40:00,some of best classic atari games coming as easter eggs in tesla v90 release in about 4 weeks thanks atari,0
2018-08-07 12:48:00,am considering taking tesla private at 420 funding secured,1
2018-08-07 13:15:00,lizclaman tesla 420,-1
2018-08-07 14:07:00,heydave7 absolutely am super appreciative of tesla shareholders will ensure their prosperity in any scenario,-1
2018-08-22 11:15:00,teslatunity tesla coming soon,0
2018-09-14 10:42:00,mcwm the muskrat is like a beaver with small ideas but it has a certain quiet dignity â¦,0
2018-09-14 11:56:00,joannmuller alanohnsman forbes the tesla board has done incredible work overseeing the largest value creation in the auto industry in 100 years despite many setbacks tesla owes its very existence to this board,0
2018-09-19 13:19:00,megangale tesla youâre most welcome sorry for the delay,0
2018-09-20 13:26:00,nhtsagov will post final safety probability stats soon model 3 has a shot at being safest car ever tested,0
2018-09-20 13:34:00,martenbenjamin nhtsagov tesla exactly all 5 star are not the same as the videos show â5 starâ just means a car met a certain threshold but injury probability stats real numbers tell you by how much,0
2018-09-20 13:44:00,tesla piece on the physics of car safety coming soon for those interested in technical details,0
2018-09-20 14:26:00,lanceulanoff key technical point is that the polar moment of inertia concentration of mass around center of a tesla to the extent of our knowledge is better than any other production car this positively affects safety handling amp driving feel extremely important metric,0
2018-09-25 12:24:00,ftomenko tesla ð,0
2018-09-26 13:44:00,ctbarker32 bdl3j tesla youâre welcome sorry for the delay,0
2018-09-26 14:25:00,scottwww tesla pace of innovation is all that matters in the long run,0
2018-10-08 11:42:00,the physics of how tesla achieved best safety of any cars ever tested note when vehicle weight is taken into account order is more like xs then 3 but they are all very close,1
2018-10-09 13:40:00,fredericlambert no such thing as a âfull refreshâ at tesla or even a model year our cars are partially upgraded every month as soon as a new subsystem is ready for production there is no cadence,0
2018-10-12 12:39:00,teslaquila coming soon â¦,0
2018-10-12 14:03:00,tesla exists to help reduce risk of catastrophic climate change which affects all species on earth even if your faith in humanity is faltering this is worth caring about support makes a difference thank you,0
2018-10-15 12:44:00,alguiretim tesla haha it is actually my fav game on tesla cars right now ð,0
2018-10-15 15:27:00,model 3 motor amp gearbox still in good condition after driving 1m miles designed for ultra high endurance,0
2018-10-17 13:51:00,ajmarquez true but this will improve dramatically over next several months amp all tesla cars ever produced except early roadsters will get improvements for free continuous free overtheair software updates is a big part of why a tesla retains so much value over time,0
2018-10-22 14:15:00,mayemusk cleantechnica nytimes tesla businessinsider business thestreet cnbc forbes interesting,0
2018-10-23 14:28:00,to simplify production many tesla model s amp x interior configs will no longer be available after nov 1 order now to be sure of the one you want,-1
2018-10-23 15:10:00,get this question a lot so need to clarify that thereâs no such thing as a tesla ârefreshâ other car companies do this every 3 years but tesla constantly upgrades vehicle hardware every week,0
2018-10-25 12:43:00,cleantechnica model 3 was topselling car in us by revenue despite no advertising no paid endorsements amp no discounts competitors spent billions on marketing model 3 was product alone,0
2018-10-26 13:29:00,rstefani11 tesla taking action tesla body shops now operating in california aiming for same day body repair in most cases,0
2018-10-26 14:02:00,mcjamez tesla clearly youâre not reading my twitter,-1
2018-10-26 15:11:00,bosterogriego tesla mayemusk wsj good question,-1
2018-10-26 15:50:00,scr00chy mcjamez tesla hey thatâs my halloween costume,0
2018-10-31 13:38:00,rarelyserious tesla cool haha,0
2018-10-31 13:47:00,rarelyserious tesla for those unfamiliar this uses tesla autoparksummon slightly smarter version hopefully ready soon by next year a tesla should be able to drive around a parking lot find an empty spot read signs to confirm itâs valid amp park,0
2018-11-01 15:35:00,insideevs tesla âs r wrong but ð» in ð§  tesla makes ðs 4 overseas amp east coast in 1st half of quarter,0
2018-11-02 15:43:00,teslarati amazing results by panasonic at tesla gigafactory nevada very much appreciate extreme hard work it took to achieve this result together with pana japan cell plants teslapana partnership is producing 60 of global ev battery output,0
2018-11-09 12:41:00,tizmagik teslasupport fair point will reenable,0
2018-11-14 10:46:00,nichegamer would be fun to add to tesla,0
2018-11-15 12:27:00,tesla just acquired trucking capacity to ensure model 3 can be delivered in us by dec 31 if ordered by nov 30 ,0
2018-11-19 09:57:00,acevedolex stars4aamy tesla should be possible please ask service amp lmk response,0
2018-11-19 10:00:00,lionlifer tesla can provide heatingcoolinglightsmusic for days using battery,0
2018-11-21 10:42:00,wiredprairie tesla shifting resources from sales to service for next several days,0
2018-11-21 10:43:00,speceye tesla coming soon,0
2018-11-21 10:57:00,fredericlambert speceye tesla good idea,0
2018-11-23 15:28:00,if you donât want a tesla hereâs a list of all electric cars in north america  via cleantechnica,0
2018-11-29 13:34:00,super fun software easter eggs coming to all tesla s3x cars before the holidays romance mode toilet humor amp more video games,0
2018-11-29 13:51:00,after safety our goal is to make a tesla the most fun you could possibly have in a car,0
2018-11-30 14:06:00,rainnwilson your tesla can function as a boat for brief periods of time ,0
2018-12-11 11:28:00,business incorrect âchairmanâ is an honorific not executive role which means itâs not needed to run tesla will retire that title at tesla in 3 years 60 mins edited out end of my sentence where i said i could do whatever i want they cut âprovided i have the support of shareholdersâ,0
2018-12-12 09:47:00,johnpapa tesla you should def have a loaner will take care of it,0
2018-12-18 10:17:00,honored to work with amazing teams at spacex amp tesla,0
2018-12-19 14:39:00,erdayastronaut martinengwicht realkrauswife tesla the guides are basically just a wheel a shock absorber amp a solenoid costs a few hundred dollars in volume,0
2018-12-19 14:54:00,ecoheliguy erdayastronaut martinengwicht realkrauswife tesla autopilot doesnât need the guide wheels theyâre only there if there is a complete system failure turns will definitely be banked in future,0
2018-12-26 13:51:00,reminder to us buyers that the 7500 tax credit cuts in half in 5 days order online at  to see if there is any inventory left in your region or visit tesla stores,0
2018-12-26 14:09:00,and because electricity costs much less than gasoline a model 3 can cost about 1000 less per year to operate because itâs electric there are no oil changes smog checks tuneups fuel filter or brake pad replacements,0
2018-12-26 14:23:00,"most importantly every electric car tesla or otherwise matters to the environment we all share every time someone chooses electric the future gets a little bit brighter

if not tesla please take a look at these other options
",0
2018-12-26 14:31:00,jtrichards mmelinot chuckyyyd this is incorrect vast majority of vehicle motion is returned to the battery as the electric motors act like a generator in reverse brake pads on a tesla literally never need to be replaced for lifetime of the car,0
2018-12-26 14:38:00,magoo5042 tesla ok,0
2018-12-26 14:40:00,martinmeany we are dramatically increasing tesla superchargers within cities amp working with landlords to add home charging to apartment buildings,0
2018-12-26 14:47:00,most people donât know that the tesla supercharger network allows easy long distance travel throughout usa most of europe canada and china ,0
2018-12-28 13:16:00,excited to have larry ellison amp kathleen wilsonthompson join the tesla board ,0
2019-01-03 13:30:00,minliangtan c4mer0n burnflare kroegerove sounds great will connect you with tesla energy,0
2019-01-03 15:09:00,charliemilton reuters breakingviews tesla weirdly all the negative press seems to increase sales,0
2019-01-03 15:11:00,annerajb charliemilton reuters breakingviews tesla reveals wheels,0
2019-01-23 09:53:00,teslarati 310s stainless is better for high temp outer skin as it can take 1450 kelvin so active cooling with cryogenic fuel only has to mitigate 300 degrees of delta temp,-1
2019-01-23 10:09:00,teslarati 1750k is peak heating expected on about 20 of starship for leo entry 1600k on 20 rest drops below 1450k so no heat shield needed radiative cooling at t4 takes care of 60 of the ship another reason for steel,0
2019-01-25 12:57:00,teslarati feature has now been in place for 8 months,0
2019-01-25 12:58:00,annerajb teslarati rough beta in 2 to 3 weeks,0
2019-01-28 12:20:00,great electric car documentary about early days of tesla gm volt nissan leaf amp gadget so much has happened since then â¦ ,0
2019-01-28 12:21:00,dataoverideal tesla sure hope that happens,0
2019-01-31 15:56:00,"exciting to see all the new electric vehicles coming to market we created tesla to accelerate a sustainable future amp itâs happening
",0
2019-02-13 12:30:00,tesla model x first suv to receive a perfect crash test rating  via businessinsider,0
2019-02-14 12:35:00,tesla this is in addition to existing cabin overheat protection which come on automatically at high temps to ensure any babies or pets in the car are safe,0
2019-03-01 13:21:00,model3owners troyteslike explanation from tesla later today,0
2019-03-04 15:38:00,scottwww tesla gap in understanding is that 35k model 3 production starts this month but will not reach volume production until mid year extremely difficult to predict middle part of manufacturing scurve,0
2019-03-05 14:40:00,gfilche tesla tesla comms is fixing that was a mistake,0
2019-03-07 13:58:00,erdayastronaut privater marcbenton teslatunity model3owners tesla very little power amp only right before you get to the supercharger you wonât notice it in range,0
2019-03-07 14:05:00,copticchad erdayastronaut privater marcbenton teslatunity model3owners tesla net power to warm pack is especially low when motors are running as coolant loop routes motor heat to the pack when outside is cold amp rejects motor heat to air when outside is warm,0
2019-03-12 15:20:00,willfealey tonytesla4life teslatruth fredericlambert jeffbordencga marcbenton mrtommycampbell tesla yes,0
2019-03-14 14:49:00,teslainventory tesla next software update will increase storm watch sensitivity youâre right itâs currently too low,0
2019-03-26 12:18:00,hard to appreciate how much tesla autopilot improves enjoyment of driving until you try it,0
2019-03-26 12:20:00,zachary1978 tesla good point,0
2019-04-04 13:05:00,christesla tesla improvements coming soon,0
2019-04-04 13:12:00,davechung tesla ok,0
2019-04-08 15:36:00,obikela ceoplusch tesla yes working through regulatory approvals,0
2019-04-09 12:58:00,vincent13031925 tesla building primary structure completion seems on track for may but then it will take several months to install amp activate factory equipment,0
2019-04-09 15:11:00,bonnienorman vincent13031925 tesla no itâs better,0
2019-04-12 10:58:00,leasing now available for model 3 ,0
2019-04-12 11:08:00,28delayslater tesla mayemusk good point,0
2019-04-12 14:12:00,dirtnapdragon tesla so if we raise prices in the future will you cut tesla a check canât have it both ways,0
2019-04-12 14:24:00,dennishegstad tesla other automakers change prices constantly amp substantially by varying rebates amp discounts according to negotiating strength of buyer tesla is transparent amp consistent,0
2019-04-23 09:42:00,iluvamp ray4yu tsport100 tesla over a quarter million gasoline vehicle fires per year in usa alone ,0
2019-04-23 15:00:00,valueanalyst1 peterdevietien scottwww karpathy tesla nvidia as a robotaxi probably closer to 16 hours accounting for empty legs travel to chargercleaningservice wait times etc 30 mile penalty most likely imo over 120 paid miles impact is signicant for electricity cost battery wear cost amp larger range pack needed,0
2019-04-23 15:03:00,msitver frankluntz exactly by end of this quarter about half a million teslas will have full selfdriving hardware pending computer swap amp we will make another half million fsd cars by mid next year,0
2019-04-24 14:09:00,as mentioned before tesla full selfdriving option price will increase after may 1 you can order online at ,0
2019-04-24 14:12:00,s3xynews patfan198010 agreed weâre ramping up service centers amp tesla mobile service worldwide,0
2019-04-25 13:44:00,uk model 3 order page goes live next week followed shortly thereafter by japan australia new zealand amp hong kong,0
2019-04-26 13:04:00,insideevs great work by tesla china team amp supporting contractors,0
2019-05-07 13:16:00,new setting to receive tesla software updates immediately,0
2019-05-07 13:49:00,cryptonekoz tesla click checkbox under âadvanced settingsâ,0
2019-05-07 13:56:00,tesla too euro,0
2019-05-07 14:04:00,tesla eurovision,0
2019-05-07 14:05:00,tesla also blood gandalf the grey amp superdraco,0
2019-05-07 14:12:00,tesla my security car is called baby smurf,0
2019-05-07 14:13:00,hfinnelll tesla ð,0
2019-05-09 11:51:00,tesla heâs just kidding folks but best to turn car off just in case also 2001 was 18 years ago,0
2019-05-09 11:57:00,realhayman tesla just behind the glovebox which is presumably where the gloves are,0
2019-05-09 11:59:00,baaldrogo tesla probably shouldnât have called holding company cyberdyne systems ð,0
2019-05-17 14:32:00,mrrobcapewell tesla apple valueanalyst1 yeah feels like something is messed up with apple news app almost only ever shows negative news nickname is âthe hate streamâ ð¤£,0
2019-05-17 14:50:00,this is why we put extra filters in all tesla cars s amp x even have hospital operating room grade hepa filters,0
2019-05-22 12:42:00,teslainventory coming soon,0
2019-05-29 12:29:00,dealerofhappy tesla one dayâs grace taking into account time zone confusion will revert tomorrow,0
2019-05-30 10:12:00,anthonyfinno robertohaver tesla tesla is affecting powerful vested interests big auto amp oil companies arenât known for their gentle behavior spacex is battling us military prime contractors amp space programs of national govts no walk in the park there,0
2019-05-30 10:16:00,bdgbill teslaownerssv tesla based on our data autopilot miles appear to be twice as safe as manually driven miles and we expect this to improve further,0
2019-05-30 11:05:00,shannonzkiller nbcsnl tesla ð¤£,0
2019-05-31 13:04:00,model 3 performance ,0
2019-05-31 15:15:00,realkeith tmsp85 not enough room unless we completely delete front trunk model s amp x primary hepa filter alone is literally 1000 bigger than normal car air filter,0
2019-06-03 14:55:00,teslarati only cars made in china are eligible for these subsidies tesla has never had access to them,0
2019-06-04 14:09:00,uzakbaydaniyar tesla superchargers amp service centers coming to kazakhstan this year,0
2019-06-05 13:31:00,bloodsportcap teslarati china ev subsidies mostly end this month amp fully end in about 7 months,0
2019-06-10 10:57:00,teslatino annual tire rotation is actually optional only worthwhile if you see significant differential wear on inside vs outside of tire,0
2019-06-10 11:14:00,endyogaming teslatino good point maybe we could collect rainwater add a little antifreeze in cold climates amp make it last for years,0
2019-06-12 11:33:00,true cost of operating a tesla is much lower than other cars,0
2019-06-18 15:19:00,teslatn 28delayslater cnbc ð¤£ð¤£,0
2019-06-19 11:59:00,teslarati this will be our most difficult launch ever,0
2019-06-19 12:13:00,techau tesla will consider,0
2019-06-19 14:17:00,starting next month tesla will charge 1000 for color black same price as silver,0
2019-06-20 14:46:00,kids playing beach buggy in tesla store ,0
2019-06-21 13:01:00,tmornini tesla no weâre already recycling them,0
2019-06-21 14:02:00,tmornini tesla tesla is putting significant resources into highefficiency battery recycling makes both environmental amp economic sense please consider joining if interested in recycling engineering,0
2019-06-21 14:18:00,alexavoigt valueanalyst1 mickpaul4 tesla a few other small things change but pretty close,0
2019-06-28 15:42:00,eforelectric tesla sure want to add easy importexport of images from your phone,0
2019-06-28 15:43:00,tesla fun little music tool coming later,0
2019-06-28 15:44:00,tesla tweak music amp car karaoke,0
2019-07-08 15:58:00,dmcryan tesla no problem,0
2019-07-09 13:47:00,renatakonkoly 28delayslater carolinegee8 nathanbomey usatoday tesla mayemusk that was a real sign,0
2019-07-09 15:17:00,kvlly would be cool if car took you to a random fun place traveled to by other tesla owners in the area,0
2019-07-11 13:30:00,"motor trend awards tesla model s best car of the year ever in their 70 year history
 ",0
2019-07-16 12:14:00,snazzyq phenomenalpoto aaronjleonard tailosivetech if we make all cars with fsd package selfdriving as planned any such tesla should be worth 100k to 200k as utility increases from 12 hoursweek to 60 hoursweek,0
2019-07-16 12:25:00,flcnhvy snazzyq phenomenalpoto aaronjleonard tailosivetech no since tesla will charge a  fee for being in our robotaxi fleet but it will rise to whatever the clearing price is otherwise all our cars will be bought by scalpers,0
2019-07-16 12:51:00,cost of tesla full selfdriving option increasing by 1000 on august 16,0
2019-07-16 13:23:00,as mentioned earlier this year cost of the tesla fsd option will increase every few months those who buy it earlier will see the benefit,0
2019-07-18 14:58:00,kristennetten chrisdungeon brandonjhavard i mostly drive model s performance with dev version of fsd computer our new raven powertain amp adaptive damping suspension is great next is model 3p amp then x if driving with my kids acceleration is fun on tap,0
2019-08-01 13:59:00,teslaclubin yashwanthnadal for other countries we pay in part for the local factory by selling cars there ahead of time also gives a sense of demand current rules in india prevent that but recent changes in sales tax give hope for future changes,0
2019-08-08 15:00:00,brunosilva vincent13031925 residentsponge teslarati tesla weâre working with eu regulators to improve rules spirit of rules is correct but exact language doesnât quite align with spirit navigate on autopilot working well in rest of world,0
2019-08-20 13:44:00,teslarati looking forward to seeing giga shanghai soon ð amazing work by tesla china team amp support of authorities much appreciated,0
2019-08-20 13:47:00,teslaownerssv teslarati initially model 3 later y,0
2019-08-20 13:49:00,memesofmars teslarati ray4tesla yeah would be great to get feedback from tesla supporters,0
2019-08-21 15:03:00,teslatrip arctechinc we need to complete internal qa testing for safety which will hopefully be done in about 4 weeks,0
2019-08-23 12:01:00,minimalduck tesla teslarati ok,0
2019-08-29 14:56:00,hjorturbrynjars ennnafnlaus tesla very soon sorry for the delay,0
2019-09-05 12:09:00,teslatrip still too buggy to be in wide eap requires more testing hopefully going to wide eap next week,0
2019-09-05 12:45:00,ethelreddy1 tesla looking into it,0
2019-09-10 15:05:00,kimpaquette tesla for sure,0
2019-09-11 10:09:00,teslaownerssv flcnhvy nichegamer of course,0
2019-09-11 10:10:00,renatakonkoly teslaownerssv flcnhvy nichegamer cuphead,0
2019-09-12 15:49:00,teslarati autopilot active crash prevention keeps getting better as we examine every crash for improvement amp then upload smarter software ironically i hope weâre never on the list,0
2019-09-16 11:02:00,justpaulinelol teslaownerssv kristennetten model3owners service center expansion is at max speed so yes,0
2019-09-16 12:43:00,kristennetten evafoxu justpaulinelol teslaownerssv model3owners i want this tshirt,0
2019-09-16 12:49:00,sofiaan kristennetten evafoxu justpaulinelol teslaownerssv model3owners great conversationstarter,0
2019-09-16 13:35:00,teslarati feeling lucky google tribute or hungry are 100 intended for max enjoyment of tesla owner if location has destination chargers thatâs a plus but car should only route there if location is great this will be hit amp miss initially but should hone towards excellent over time,0
2019-09-17 12:09:00,teslarati itâs a start we expect these track times to be beaten by the actual production 7 seat model s plaid variant that goes into production around octnov next year,0
2019-09-17 12:12:00,zainraz4 teslarati no original 5 forward facing seats plus 2 rearfacing smaller seats the new rear seats will accommodate larger passengers than before,0
2019-09-17 12:13:00,justpaulinelol teslarati new roadster and x will come later,0
2019-09-17 12:14:00,flcnhvy teslarati absolutely,0
2019-09-17 12:17:00,danielcardena teslarati rear facing but roomier great for family gatherings i did a road trip across america with my five boys amp talulah in the 7 seat model s several years ago,0
2019-09-17 12:21:00,teslaownerssv flcnhvy teslarati no but very close,0
